{
  "artifact_inputs": {
    "packets": [
      {
        "artifact_id": "pkt_avrp_20250918_2c616c061bd44e79",
        "artifact_type": "packet",
        "schema_version": "v1.0.0"
      },
      {
        "artifact_id": "pkt_base_20250918_c5e29def4b368fa2",
        "artifact_type": "packet",
        "schema_version": "v1.0.0"
      },
      {
        "artifact_id": "pkt_cnfl_20250918_1affa3696e4c4b8f",
        "artifact_type": "packet",
        "schema_version": "v1.0.0"
      },
      {
        "artifact_id": "pkt_cnfl_20250918_621011937a1a6dc9",
        "artifact_type": "packet",
        "schema_version": "v1.0.0"
      },
      {
        "artifact_id": "pkt_splt_20250918_61239626aa15c622",
        "artifact_type": "packet",
        "schema_version": "v1.0.0"
      },
      {
        "artifact_id": "pkt_stal_20250918_7dae26353a71fda8",
        "artifact_type": "packet",
        "schema_version": "v1.0.0"
      },
      {
        "artifact_id": "pkt_trnd_20250918_02f95006ab180059",
        "artifact_type": "packet",
        "schema_version": "v1.0.0"
      }
    ],
    "ranking": {
      "artifact_id": "run_local_20250918_3e3337a6d2837850",
      "artifact_type": "ranking",
      "schema_version": "v1.0.0"
    },
    "run_manifest": {
      "artifact_id": "run_local_20250918_3e3337a6d2837850",
      "artifact_type": "run_manifest",
      "schema_version": "v1.0.0"
    }
  },
  "artifact_type": "dashboard_payload",
  "as_of_date": "2025-09-18",
  "config_fingerprint": "7da318e9bf2a3f80782b3370fe5246eff1be663b92e098a6cfdb97b904eb55c7",
  "environment": "local",
  "generated_at": "2025-09-18T21:15:00Z",
  "rows": [
    {
      "eligibility_status": "eligible",
      "packet_id": "pkt_avrp_20250918_2c616c061bd44e79",
      "prioritization_status": "ranked",
      "setup_family": "avwap_reclaim",
      "symbol": "AVRP"
    },
    {
      "eligibility_status": "ineligible",
      "packet_id": "pkt_cnfl_20250918_621011937a1a6dc9",
      "prioritization_status": "suppressed",
      "setup_family": "avwap_reclaim",
      "symbol": "CNFL"
    },
    {
      "eligibility_status": "eligible",
      "packet_id": "pkt_base_20250918_c5e29def4b368fa2",
      "prioritization_status": "ranked",
      "setup_family": "base_breakout",
      "symbol": "BASE"
    },
    {
      "eligibility_status": "eligible",
      "packet_id": "pkt_cnfl_20250918_1affa3696e4c4b8f",
      "prioritization_status": "ranked",
      "setup_family": "base_breakout",
      "symbol": "CNFL"
    },
    {
      "eligibility_status": "ineligible",
      "packet_id": "pkt_splt_20250918_61239626aa15c622",
      "prioritization_status": "suppressed",
      "setup_family": "trend_pullback",
      "symbol": "SPLT"
    },
    {
      "eligibility_status": "ineligible",
      "packet_id": "pkt_stal_20250918_7dae26353a71fda8",
      "prioritization_status": "suppressed",
      "setup_family": "trend_pullback",
      "symbol": "STAL"
    },
    {
      "eligibility_status": "ineligible",
      "packet_id": "pkt_trnd_20250918_02f95006ab180059",
      "prioritization_status": "suppressed",
      "setup_family": "trend_pullback",
      "symbol": "TRND"
    }
  ],
  "run_id": "run_local_20250918_3e3337a6d2837850",
  "schema_version": "v1.0.0",
  "summary": {
    "eligible_count": 3,
    "ineligible_count": 4,
    "ranked_count": 3
  }
}